{
  "closure_version": "snapshot-closure-v1",
  "entry_url": "https://docs.stripe.com/",
  "task_script_digest": "ad3245cef7c2f2d322c9f4a8a865266cf04685da7fd799d0804fd611e748636b",
  "capture_environment_digest": "5b24ecc6710e707e19bb9cdded99e4136f5753e3523547ad62186f9fe8705a4d",
  "captured_at": "2026-08-19T17:52:12.394Z",
  "authenticated": false,
  "replay_profiles": [
    {
      "replay_profile_id": "stripe-desktop-keyboard-standard",
      "viewport_width_css_px": 1440,
      "viewport_height_css_px": 900,
      "device_scale_factor": 2,
      "input_modality": "keyboard",
      "prefers_reduced_motion": "no-preference",
      "prefers_contrast": "no-preference",
      "color_scheme": "light",
      "locale": "zh-CN",
      "timezone": "Asia/Shanghai",
      "assistive_technology_id": "none",
      "browser_engine_digest": "ee37661755341e9fc1babf9c20ec09d6a36e50aa8713ceb08082f8bbe2d8217d"
    }
  ],
  "network_records": [],
  "observation_records": [],
  "outbound_effect_ledger_digest": "4f53cda18c2baa0c0354bb5f9a3ecbe5ed12ab4d8e11ba873c2f11161202b945",
  "completeness_status": "incomplete",
  "manifest_digest": "a8e80babac6648b6a92ce01648cb64e4936d903ed47358b622aeadf576844052"
}
